{
  "machine_interface": 2,
  "host": "192.0.2.10",
  "app": "blog",
  "deployment_type": "container",
  "current": "1.4.0",
  "releases": [
    {
      "release": "1.4.0",
      "deployed_at": "2026-10-20T12:00:00Z",
      "image": "example/blog:1.4.0",
      "image_digest": "sha256:abababababababababababababababababababababababababababababababab",
      "config_commit": "8f2c1d0e9b7a6f5e4d3c2b1a0f9e8d7c6b5a4f3e",
      "actor": "dash:alice",
      "current": true,
      "rollback_available": false,
      "reason": "current release"
    },
    {
      "release": "1.3.0",
      "deployed_at": "2026-10-19T10:00:00Z",
      "image": "example/blog:1.3.0",
      "image_digest": "sha256:cdcdcdcdcdcdcdcdcdcdcdcdcdcdcdcdcdcdcdcdcdcdcdcdcdcdcdcdcdcdcdcd",
      "actor": "cli:tyler@laptop",
      "current": false,
      "rollback_available": true
    },
    {
      "release": "1.2.0",
      "deployed_at": "2026-10-17T12:00:00Z",
      "image": "example/blog:1.2.0",
      "image_digest": "sha256:efefefefefefefefefefefefefefefefefefefefefefefefefefefefefefefef",
      "current": false,
      "rollback_available": false,
      "reason": "no containers retained for this version (keep_versions retention)"
    }
  ]
}
